{"identifier":"https://me.big.tuwien.ac.at/EAModelSet/id-7b3137ef-32e3-4089-a2d8-8a9a4a400eb4","archimateId":"id-7b3137ef-32e3-4089-a2d8-8a9a4a400eb4","name":"(new model)","description":"","formats":["XML","CSV","JSON","ARCHIMATE"],"source":"GitHub","repository":"","license":"","sourceFile":"raw-data/github/xml/archimatemodel.xml","sourceFormat":"XML","timestamp":"2023-07-06T09:29:17","tags":[],"duplicates":[],"language":"nn","elements":[{"id":"id-055970dc-7489-443f-85e6-436ba190cc38","name":"melding","type":"BusinessObject","layer":"business"},{"id":"id-3d5ae8f0-b30b-4780-9d36-339827385671","name":"aanhouding","type":"BusinessObject","layer":"business"},{"id":"id-f568e701-1146-4a2c-a8e7-77cd2ad829af","name":"aangifte","type":"BusinessObject","layer":"business"},{"id":"id-95e81a51-b106-4a01-aeb3-29bb88293da9","name":"incident","type":"BusinessObject","layer":"business"},{"id":"id-9fbc08e6-6035-4a64-be36-0e11ad5e7946","name":"meding registreren","type":"ApplicationService","layer":"application"},{"id":"id-0425f279-bdaa-40cd-a1e1-eccb2a82ba80","name":"aanhouding registreren","type":"ApplicationService","layer":"application"},{"id":"id-ea2858ea-59ae-40bd-b5eb-f6d47923ddf6","name":"aangifte registreren","type":"ApplicationService","layer":"application"},{"id":"id-292646f6-c701-47db-93d5-ad4339a356b1","name":"vastleggen incident","type":"ApplicationFunction","layer":"application"},{"id":"id-547ed4f8-afbd-4b88-915c-6d2ed5b0f94c","name":"vastleggen melding","type":"ApplicationFunction","layer":"application"},{"id":"id-fcffec28-6dfb-4cb1-ab64-2c123262ef8f","name":"vastleggen aanhouding","type":"ApplicationFunction","layer":"application"},{"id":"id-e34172e8-1814-4676-9ddd-cbb12f12602c","name":"vastleggen aangifte","type":"ApplicationFunction","layer":"application"},{"id":"id-9d5b6f84-e2a0-476d-9615-bcd3390da009","name":"bvh","type":"ApplicationComponent","layer":"application"},{"id":"id-c23bdacc-788e-4b6f-b678-59857a44f303","name":"opp","type":"ApplicationComponent","layer":"application"},{"id":"id-be27e1de-2d7d-4d54-9784-4f10d64baa43","name":"connect","type":"ApplicationComponent","layer":"application"},{"id":"id-093fb5fe-0547-46cd-bce4-ca8485a827a7","name":"gms","type":"ApplicationComponent","layer":"application"}],"relationships":[{"id":"id-04155091-83ba-427a-a36d-3aa1038e9a05","sourceId":"id-95e81a51-b106-4a01-aeb3-29bb88293da9","targetId":"id-055970dc-7489-443f-85e6-436ba190cc38","type":"Association"},{"id":"id-996cc489-6a0f-406e-80e6-5057b9e586b4","sourceId":"id-055970dc-7489-443f-85e6-436ba190cc38","targetId":"id-3d5ae8f0-b30b-4780-9d36-339827385671","type":"Association"},{"id":"id-2f33f539-628a-4e4b-a76d-792e8f52596d","sourceId":"id-3d5ae8f0-b30b-4780-9d36-339827385671","targetId":"id-f568e701-1146-4a2c-a8e7-77cd2ad829af","type":"Association"},{"id":"id-6acec0bb-904e-49a6-952a-dbd0857d958f","sourceId":"id-292646f6-c701-47db-93d5-ad4339a356b1","targetId":"id-9fbc08e6-6035-4a64-be36-0e11ad5e7946","type":"Realization"},{"id":"id-2b09036c-ff2e-419f-bfea-501367826f2a","sourceId":"id-547ed4f8-afbd-4b88-915c-6d2ed5b0f94c","targetId":"id-9fbc08e6-6035-4a64-be36-0e11ad5e7946","type":"Realization"},{"id":"id-1177768c-9728-447d-8af0-92ffc698f2bb","sourceId":"id-fcffec28-6dfb-4cb1-ab64-2c123262ef8f","targetId":"id-0425f279-bdaa-40cd-a1e1-eccb2a82ba80","type":"Realization"},{"id":"id-ae600ff3-878f-4570-8230-7f5ff9b8cea6","sourceId":"id-e34172e8-1814-4676-9ddd-cbb12f12602c","targetId":"id-ea2858ea-59ae-40bd-b5eb-f6d47923ddf6","type":"Realization"},{"id":"id-d27e47c6-329e-47f1-8d16-c2440c0865be","sourceId":"id-9d5b6f84-e2a0-476d-9615-bcd3390da009","targetId":"id-292646f6-c701-47db-93d5-ad4339a356b1","type":"Assignment"},{"id":"id-c4ff76a1-879a-48c6-85fb-1f834b820408","sourceId":"id-9d5b6f84-e2a0-476d-9615-bcd3390da009","targetId":"id-547ed4f8-afbd-4b88-915c-6d2ed5b0f94c","type":"Assignment"},{"id":"id-c16b56fa-daee-4d27-a82c-e3bce344ea3c","sourceId":"id-9d5b6f84-e2a0-476d-9615-bcd3390da009","targetId":"id-fcffec28-6dfb-4cb1-ab64-2c123262ef8f","type":"Assignment"},{"id":"id-b1294260-1df9-49cb-8171-600e47076f83","sourceId":"id-9d5b6f84-e2a0-476d-9615-bcd3390da009","targetId":"id-e34172e8-1814-4676-9ddd-cbb12f12602c","type":"Assignment"},{"id":"id-22c6eebf-01c7-49f3-9722-28e416d4c6b1","sourceId":"id-c23bdacc-788e-4b6f-b678-59857a44f303","targetId":"id-292646f6-c701-47db-93d5-ad4339a356b1","type":"Assignment"},{"id":"id-53480be0-f0e4-48d5-b615-d66e3dcbc028","sourceId":"id-c23bdacc-788e-4b6f-b678-59857a44f303","targetId":"id-547ed4f8-afbd-4b88-915c-6d2ed5b0f94c","type":"Assignment"},{"id":"id-d868ece0-5f92-4860-9d12-8e38a53a74d8","sourceId":"id-c23bdacc-788e-4b6f-b678-59857a44f303","targetId":"id-fcffec28-6dfb-4cb1-ab64-2c123262ef8f","type":"Assignment"},{"id":"id-ca6314fd-3efc-471a-b59c-afb80b2d46f5","sourceId":"id-c23bdacc-788e-4b6f-b678-59857a44f303","targetId":"id-e34172e8-1814-4676-9ddd-cbb12f12602c","type":"Assignment"},{"id":"id-349cf074-eca5-4959-9f4a-c72aed46553d","sourceId":"id-093fb5fe-0547-46cd-bce4-ca8485a827a7","targetId":"id-292646f6-c701-47db-93d5-ad4339a356b1","type":"Assignment"},{"id":"id-8800b5cc-784c-4d07-a611-050fcf206254","sourceId":"id-093fb5fe-0547-46cd-bce4-ca8485a827a7","targetId":"id-547ed4f8-afbd-4b88-915c-6d2ed5b0f94c","type":"Assignment"},{"id":"id-f401c5c5-b301-434e-a10e-56229d5f30ea","sourceId":"id-be27e1de-2d7d-4d54-9784-4f10d64baa43","targetId":"id-e34172e8-1814-4676-9ddd-cbb12f12602c","type":"Assignment"},{"id":"id-6e65e305-a33e-4989-aab6-ad8455511ac2","sourceId":"id-292646f6-c701-47db-93d5-ad4339a356b1","targetId":"id-95e81a51-b106-4a01-aeb3-29bb88293da9","type":"Access"},{"id":"id-8bbf091f-f30b-4948-bad2-b007585d8a1d","sourceId":"id-547ed4f8-afbd-4b88-915c-6d2ed5b0f94c","targetId":"id-055970dc-7489-443f-85e6-436ba190cc38","type":"Access"},{"id":"id-cf8d828e-e3c2-4cb2-9232-70931f8cf7f3","sourceId":"id-fcffec28-6dfb-4cb1-ab64-2c123262ef8f","targetId":"id-3d5ae8f0-b30b-4780-9d36-339827385671","type":"Access"},{"id":"id-a6fa546a-eeeb-45ed-ab24-9b274a6ef567","sourceId":"id-e34172e8-1814-4676-9ddd-cbb12f12602c","targetId":"id-f568e701-1146-4a2c-a8e7-77cd2ad829af","type":"Access"}],"views":[{"id":"id-4bf7a121-2ffd-42f0-b7b9-817073017c06","name":"Default View","viewpoint":""}]}