{"identifier":"https://me.big.tuwien.ac.at/EAModelSet/_viXHACfbEeuxZMUIY-ihGw","archimateId":"_viXHACfbEeuxZMUIY-ihGw","name":"payments-arch1","description":"","formats":["XML","CSV","JSON","ARCHIMATE"],"source":"GenMyModel","repository":"","license":"","sourceFile":"raw-data/genmymodel/_vixhacfbeeuxzmuiy-ihgw.xml","sourceFormat":"XML","timestamp":"2023-07-06T10:01:17","tags":[],"duplicates":[],"language":"en","elements":[{"id":"_viZjjSfbEeuxZMUIY-ihGw","name":"WebForm Custom","type":"ApplicationService","layer":"application"},{"id":"_viZjjyfbEeuxZMUIY-ihGw","name":"WebHook Public Node","type":"ApplicationService","layer":"application"},{"id":"_viZjkSfbEeuxZMUIY-ihGw","name":"CloudPayments","type":"ApplicationService","layer":"application"},{"id":"_viZjkyfbEeuxZMUIY-ihGw","name":"others","type":"ApplicationService","layer":"application"},{"id":"_viZjlSfbEeuxZMUIY-ihGw","name":"Software","type":"SystemSoftware","layer":"technology"},{"id":"_viZjlyfbEeuxZMUIY-ihGw","name":"Collaboration","type":"BusinessCollaboration","layer":"business"},{"id":"_viZjmSfbEeuxZMUIY-ihGw","name":"Event Pub\\Sub Bus","type":"SystemSoftware","layer":"technology"},{"id":"_viZjmyfbEeuxZMUIY-ihGw","name":"App","type":"ApplicationService","layer":"application"},{"id":"_viZjnSfbEeuxZMUIY-ihGw","name":"General Store","type":"TechnologyCollaboration","layer":"technology"},{"id":"_viZjnyfbEeuxZMUIY-ihGw","name":"Internal Store","type":"TechnologyCollaboration","layer":"technology"},{"id":"_viZjoSfbEeuxZMUIY-ihGw","name":"Collaboration","type":"TechnologyCollaboration","layer":"technology"},{"id":"_viZjoyfbEeuxZMUIY-ihGw","name":"Core Service","type":"ApplicationService","layer":"application"},{"id":"_viZjpSfbEeuxZMUIY-ihGw","name":"Internal store","type":"TechnologyCollaboration","layer":"technology"},{"id":"_viZjpyfbEeuxZMUIY-ihGw","name":"Http Adapter service","type":"ApplicationService","layer":"application"},{"id":"_viZjqyfbEeuxZMUIY-ihGw","name":"Event Bus Adapter","type":"ApplicationService","layer":"application"},{"id":"_viZjrSfbEeuxZMUIY-ihGw","name":"Service","type":"ApplicationService","layer":"application"},{"id":"_viZjryfbEeuxZMUIY-ihGw","name":"Http Form Service","type":"ApplicationService","layer":"application"}],"relationships":[{"id":"_viZjsSfbEeuxZMUIY-ihGw","sourceId":"_viZjkSfbEeuxZMUIY-ihGw","targetId":"_viZjjyfbEeuxZMUIY-ihGw","type":"Serving"},{"id":"_viZjsyfbEeuxZMUIY-ihGw","sourceId":"_viZjjyfbEeuxZMUIY-ihGw","targetId":"_viZjpyfbEeuxZMUIY-ihGw","type":"Serving"},{"id":"_viZjtSfbEeuxZMUIY-ihGw","sourceId":"_viZjjSfbEeuxZMUIY-ihGw","targetId":"_viZjpyfbEeuxZMUIY-ihGw","type":"Serving"},{"id":"_viZjtyfbEeuxZMUIY-ihGw","sourceId":"_viZjpyfbEeuxZMUIY-ihGw","targetId":"_viZjoyfbEeuxZMUIY-ihGw","type":"Serving"},{"id":"_viZjuSfbEeuxZMUIY-ihGw","sourceId":"_viZjoyfbEeuxZMUIY-ihGw","targetId":"_viZjpyfbEeuxZMUIY-ihGw","type":"Serving"},{"id":"_viZjuyfbEeuxZMUIY-ihGw","sourceId":"_viZjpyfbEeuxZMUIY-ihGw","targetId":"_viZjjSfbEeuxZMUIY-ihGw","type":"Serving"},{"id":"_viZjvSfbEeuxZMUIY-ihGw","sourceId":"_viZjoyfbEeuxZMUIY-ihGw","targetId":"_viZjpSfbEeuxZMUIY-ihGw","type":"Serving"},{"id":"_viZjvyfbEeuxZMUIY-ihGw","sourceId":"_viZjpSfbEeuxZMUIY-ihGw","targetId":"_viZjoyfbEeuxZMUIY-ihGw","type":"Serving"},{"id":"_viZjwSfbEeuxZMUIY-ihGw","sourceId":"_viZjoyfbEeuxZMUIY-ihGw","targetId":"_viZjnSfbEeuxZMUIY-ihGw","type":"Serving"},{"id":"_viZjwyfbEeuxZMUIY-ihGw","sourceId":"_viZjnSfbEeuxZMUIY-ihGw","targetId":"_viZjoyfbEeuxZMUIY-ihGw","type":"Serving"},{"id":"_viZjzSfbEeuxZMUIY-ihGw","sourceId":"_viZjoyfbEeuxZMUIY-ihGw","targetId":"_viZjqyfbEeuxZMUIY-ihGw","type":"Serving"},{"id":"_viZjzyfbEeuxZMUIY-ihGw","sourceId":"_viZjqyfbEeuxZMUIY-ihGw","targetId":"_viZjmSfbEeuxZMUIY-ihGw","type":"Serving"},{"id":"_viZj0SfbEeuxZMUIY-ihGw","sourceId":"_viZjmSfbEeuxZMUIY-ihGw","targetId":"_viZjmyfbEeuxZMUIY-ihGw","type":"Serving"},{"id":"_viZj0yfbEeuxZMUIY-ihGw","sourceId":"_viZjoyfbEeuxZMUIY-ihGw","targetId":"_viZjkSfbEeuxZMUIY-ihGw","type":"Serving"},{"id":"_viZj1SfbEeuxZMUIY-ihGw","sourceId":"_viZjjSfbEeuxZMUIY-ihGw","targetId":"_viZjryfbEeuxZMUIY-ihGw","type":"Serving"},{"id":"_viZj1yfbEeuxZMUIY-ihGw","sourceId":"_viZjryfbEeuxZMUIY-ihGw","targetId":"_viZjoyfbEeuxZMUIY-ihGw","type":"Serving"}],"views":[{"id":"_viZjQCfbEeuxZMUIY-ihGw","name":"archimate-diagram","viewpoint":""}]}