{"identifier":"https://me.big.tuwien.ac.at/EAModelSet/_igZ_cKctEeqEM7mFKilpXw","archimateId":"_igZ_cKctEeqEM7mFKilpXw","name":"Belarus","description":"","formats":["XML","CSV","JSON","ARCHIMATE"],"source":"GenMyModel","repository":"","license":"","sourceFile":"raw-data/genmymodel/_igz_ckcteeqem7mfkilpxw.xml","sourceFormat":"XML","timestamp":"2023-07-06T10:01:17","tags":[],"duplicates":[],"language":"ru","elements":[{"id":"_hZvbkYlbEDikLZ5Pke9ylQ","name":"Запрос пропуска на территорию БелАЭС через ОРБ/ТАИ с приложением:1. Списка.2. Информации о запросе, направленном ранее (был коллективный)3. Официальных запросов на ШП, ШПНР","type":"BusinessFunction","layer":"business"},{"id":"_y_cuAIlbEDikLZ5Pke9ylQ","name":"Обращение в АСЭ для подготовки запроса с их стороны в СЭЗ РБ","type":"BusinessFunction","layer":"business"},{"id":"_3T2icYlbEDikLZ5Pke9ylQ","name":"Запрос в СЭЗ РБ за 7 дней от АСЭ с приложением:1. Списка2. Результатов 2-х тестов на вирус","type":"BusinessFunction","layer":"business"},{"id":"__KUvcYlbEDikLZ5Pke9ylQ","name":"Обработка запроса и решение через 5 дней","type":"BusinessFunction","layer":"business"},{"id":"_HcUa0IlcEDikLZ5Pke9ylQ","name":"Запрос пропуска на сотрудников РАДИКО","type":"BusinessFunction","layer":"business"},{"id":"_JAe8QYlcEDikLZ5Pke9ylQ","name":"ОРБ/ТАИ","type":"BusinessActor","layer":"business"},{"id":"_Z8LBUYlcEDikLZ5Pke9ylQ","name":"Получение справки о состоянии здоровья и 2 теста на COVID-19","type":"BusinessFunction","layer":"business"},{"id":"_fr2g8IlcEDikLZ5Pke9ylQ","name":"Обращение в АСЭ для формирования списка для передачи на границу","type":"BusinessFunction","layer":"business"},{"id":"_uLh2kYlcEDikLZ5Pke9ylQ","name":"Сдача 2-х дополнительных тестов","type":"BusinessFunction","layer":"business"},{"id":"_6OaZoIlcEDikLZ5Pke9ylQ","name":"РАДИКО","type":"BusinessCollaboration","layer":"business"},{"id":"_8XDhIIlcEDikLZ5Pke9ylQ","name":"Сотрудник","type":"BusinessActor","layer":"business"},{"id":"_AWB4IIldEDikLZ5Pke9ylQ","name":"АО ИК АСЭ","type":"BusinessRole","layer":"business"},{"id":"_C14lwYldEDikLZ5Pke9ylQ","name":"СЭЗ РБ","type":"BusinessRole","layer":"business"},{"id":"_E57hIYldEDikLZ5Pke9ylQ","name":"Выезд в день получения тестов и перемещение до границы со стороны РФ","type":"BusinessFunction","layer":"business"},{"id":"_HROIoIldEDikLZ5Pke9ylQ","name":"Сотрудник","type":"BusinessActor","layer":"business"},{"id":"_LYPBUYldEDikLZ5Pke9ylQ","name":"Перечение границы пешком","type":"BusinessFunction","layer":"business"},{"id":"_WSqHgYldEDikLZ5Pke9ylQ","name":"Запрос в ГК \"Росатом\" для разрешения пересечения границы (1 день)","type":"BusinessFunction","layer":"business"},{"id":"_Zoez0IldEDikLZ5Pke9ylQ","name":"Положительное решение по запросу и передача данных на границу (1 день)","type":"BusinessFunction","layer":"business"},{"id":"_eEJG0YldEDikLZ5Pke9ylQ","name":"АО ИК АСЭ","type":"BusinessRole","layer":"business"},{"id":"_fh6FUIldEDikLZ5Pke9ylQ","name":"ГК Росатом","type":"BusinessRole","layer":"business"},{"id":"_31rLMIldEDikLZ5Pke9ylQ","name":"Заселение в Санаторий \"Приозерный\" (предоставить тест сроком давности не старше 2-х дней)","type":"BusinessFunction","layer":"business"},{"id":"_AMrSYIleEDikLZ5Pke9ylQ","name":"Такси до санатория (или транспорт от АО ИК АСЭ)","type":"BusinessFunction","layer":"business"},{"id":"_Nqx2QYleEDikLZ5Pke9ylQ","name":"Выезд в санаторий и забор анализов в первый рабочий день после заселения","type":"BusinessFunction","layer":"business"},{"id":"_Sz5sMIleEDikLZ5Pke9ylQ","name":"СЭЗ РБ","type":"BusinessRole","layer":"business"},{"id":"_ZXWLEYleEDikLZ5Pke9ylQ","name":"Ожидание результатов тестов 3-4 дня","type":"BusinessFunction","layer":"business"},{"id":"_ca1xQYleEDikLZ5Pke9ylQ","name":"Сотрудник","type":"BusinessActor","layer":"business"},{"id":"_eX564IleEDikLZ5Pke9ylQ","name":"Выход на площадку","type":"BusinessFunction","layer":"business"},{"id":"_kZb_gYleEDikLZ5Pke9ylQ","name":"РАДИКО","type":"BusinessCollaboration","layer":"business"},{"id":"_w-A6YYleEDikLZ5Pke9ylQ","name":"Обработка запроса и решение (до 45 дней, если не было запроса ранее)","type":"BusinessFunction","layer":"business"},{"id":"_z68lkYleEDikLZ5Pke9ylQ","name":"Служба безопасности Белорусской АЭС","type":"BusinessRole","layer":"business"}],"relationships":[{"id":"_KKDzcYlcEDikLZ5Pke9ylQ","sourceId":"_JAe8QYlcEDikLZ5Pke9ylQ","targetId":"_HcUa0IlcEDikLZ5Pke9ylQ","type":"Association"},{"id":"_KfU40YlcEDikLZ5Pke9ylQ","sourceId":"_hZvbkYlbEDikLZ5Pke9ylQ","targetId":"_HcUa0IlcEDikLZ5Pke9ylQ","type":"Triggering"},{"id":"_Y4KmoYlcEDikLZ5Pke9ylQ","sourceId":"_3T2icYlbEDikLZ5Pke9ylQ","targetId":"__KUvcYlbEDikLZ5Pke9ylQ","type":"Triggering"},{"id":"_mIcw8YlcEDikLZ5Pke9ylQ","sourceId":"_y_cuAIlbEDikLZ5Pke9ylQ","targetId":"_3T2icYlbEDikLZ5Pke9ylQ","type":"Triggering"},{"id":"_0GNFQYlcEDikLZ5Pke9ylQ","sourceId":"_Z8LBUYlcEDikLZ5Pke9ylQ","targetId":"_y_cuAIlbEDikLZ5Pke9ylQ","type":"Triggering"},{"id":"_7VdhQYlcEDikLZ5Pke9ylQ","sourceId":"_6OaZoIlcEDikLZ5Pke9ylQ","targetId":"_fr2g8IlcEDikLZ5Pke9ylQ","type":"Association"},{"id":"_73nME4lcEDikLZ5Pke9ylQ","sourceId":"_6OaZoIlcEDikLZ5Pke9ylQ","targetId":"_y_cuAIlbEDikLZ5Pke9ylQ","type":"Association"},{"id":"_9ZICIYlcEDikLZ5Pke9ylQ","sourceId":"_Z8LBUYlcEDikLZ5Pke9ylQ","targetId":"_8XDhIIlcEDikLZ5Pke9ylQ","type":"Association"},{"id":"_B3S2kYldEDikLZ5Pke9ylQ","sourceId":"_AWB4IIldEDikLZ5Pke9ylQ","targetId":"_3T2icYlbEDikLZ5Pke9ylQ","type":"Association"},{"id":"_EAtaI4ldEDikLZ5Pke9ylQ","sourceId":"_C14lwYldEDikLZ5Pke9ylQ","targetId":"__KUvcYlbEDikLZ5Pke9ylQ","type":"Association"},{"id":"_IZNrcYldEDikLZ5Pke9ylQ","sourceId":"_uLh2kYlcEDikLZ5Pke9ylQ","targetId":"_HROIoIldEDikLZ5Pke9ylQ","type":"Association"},{"id":"_JEXhQYldEDikLZ5Pke9ylQ","sourceId":"_HROIoIldEDikLZ5Pke9ylQ","targetId":"_E57hIYldEDikLZ5Pke9ylQ","type":"Association"},{"id":"_JlClY4ldEDikLZ5Pke9ylQ","sourceId":"_uLh2kYlcEDikLZ5Pke9ylQ","targetId":"_E57hIYldEDikLZ5Pke9ylQ","type":"Triggering"},{"id":"_QbFQIYldEDikLZ5Pke9ylQ","sourceId":"_3T2icYlbEDikLZ5Pke9ylQ","targetId":"_E57hIYldEDikLZ5Pke9ylQ","type":"Triggering"},{"id":"_TNUuQYldEDikLZ5Pke9ylQ","sourceId":"_E57hIYldEDikLZ5Pke9ylQ","targetId":"_LYPBUYldEDikLZ5Pke9ylQ","type":"Triggering"},{"id":"_g_tgEIldEDikLZ5Pke9ylQ","sourceId":"_eEJG0YldEDikLZ5Pke9ylQ","targetId":"_WSqHgYldEDikLZ5Pke9ylQ","type":"Association"},{"id":"_hTZREoldEDikLZ5Pke9ylQ","sourceId":"_fh6FUIldEDikLZ5Pke9ylQ","targetId":"_Zoez0IldEDikLZ5Pke9ylQ","type":"Association"},{"id":"_iRfRAIldEDikLZ5Pke9ylQ","sourceId":"_WSqHgYldEDikLZ5Pke9ylQ","targetId":"_Zoez0IldEDikLZ5Pke9ylQ","type":"Triggering"},{"id":"_kh4mU4ldEDikLZ5Pke9ylQ","sourceId":"_fr2g8IlcEDikLZ5Pke9ylQ","targetId":"_WSqHgYldEDikLZ5Pke9ylQ","type":"Triggering"},{"id":"_0YxmgoldEDikLZ5Pke9ylQ","sourceId":"_Zoez0IldEDikLZ5Pke9ylQ","targetId":"_E57hIYldEDikLZ5Pke9ylQ","type":"Triggering"},{"id":"_64RZgYldEDikLZ5Pke9ylQ","sourceId":"_LYPBUYldEDikLZ5Pke9ylQ","targetId":"_HROIoIldEDikLZ5Pke9ylQ","type":"Association"},{"id":"_7V0RI4ldEDikLZ5Pke9ylQ","sourceId":"_31rLMIldEDikLZ5Pke9ylQ","targetId":"_HROIoIldEDikLZ5Pke9ylQ","type":"Association"},{"id":"_B7VzoYleEDikLZ5Pke9ylQ","sourceId":"_AMrSYIleEDikLZ5Pke9ylQ","targetId":"_HROIoIldEDikLZ5Pke9ylQ","type":"Association"},{"id":"_FO52IYleEDikLZ5Pke9ylQ","sourceId":"_LYPBUYldEDikLZ5Pke9ylQ","targetId":"_AMrSYIleEDikLZ5Pke9ylQ","type":"Triggering"},{"id":"_FyrRk4leEDikLZ5Pke9ylQ","sourceId":"_AMrSYIleEDikLZ5Pke9ylQ","targetId":"_31rLMIldEDikLZ5Pke9ylQ","type":"Triggering"},{"id":"_TlxOAYleEDikLZ5Pke9ylQ","sourceId":"_Sz5sMIleEDikLZ5Pke9ylQ","targetId":"_Nqx2QYleEDikLZ5Pke9ylQ","type":"Association"},{"id":"_U-DPk4leEDikLZ5Pke9ylQ","sourceId":"__KUvcYlbEDikLZ5Pke9ylQ","targetId":"_Nqx2QYleEDikLZ5Pke9ylQ","type":"Triggering"},{"id":"_X1gk4oleEDikLZ5Pke9ylQ","sourceId":"_31rLMIldEDikLZ5Pke9ylQ","targetId":"_Nqx2QYleEDikLZ5Pke9ylQ","type":"Triggering"},{"id":"_bqkK4oleEDikLZ5Pke9ylQ","sourceId":"_Nqx2QYleEDikLZ5Pke9ylQ","targetId":"_ZXWLEYleEDikLZ5Pke9ylQ","type":"Triggering"},{"id":"_doOKYYleEDikLZ5Pke9ylQ","sourceId":"_ca1xQYleEDikLZ5Pke9ylQ","targetId":"_ZXWLEYleEDikLZ5Pke9ylQ","type":"Association"},{"id":"_f4ZdQ4leEDikLZ5Pke9ylQ","sourceId":"_ZXWLEYleEDikLZ5Pke9ylQ","targetId":"_eX564IleEDikLZ5Pke9ylQ","type":"Triggering"},{"id":"_ggafgYleEDikLZ5Pke9ylQ","sourceId":"_ca1xQYleEDikLZ5Pke9ylQ","targetId":"_eX564IleEDikLZ5Pke9ylQ","type":"Association"},{"id":"_ljTxoIleEDikLZ5Pke9ylQ","sourceId":"_hZvbkYlbEDikLZ5Pke9ylQ","targetId":"_kZb_gYleEDikLZ5Pke9ylQ","type":"Association"},{"id":"_3XKNw4leEDikLZ5Pke9ylQ","sourceId":"_z68lkYleEDikLZ5Pke9ylQ","targetId":"_w-A6YYleEDikLZ5Pke9ylQ","type":"Association"},{"id":"_9Ot3A4leEDikLZ5Pke9ylQ","sourceId":"_HcUa0IlcEDikLZ5Pke9ylQ","targetId":"_w-A6YYleEDikLZ5Pke9ylQ","type":"Triggering"},{"id":"_DSR784lfEDikLZ5Pke9ylQ","sourceId":"_w-A6YYleEDikLZ5Pke9ylQ","targetId":"_eX564IleEDikLZ5Pke9ylQ","type":"Triggering"}],"views":[{"id":"_igamgactEeqEM7mFKilpXw","name":"archimate-diagram","viewpoint":""}]}