{"identifier":"https://me.big.tuwien.ac.at/EAModelSet/5a4b03f0","archimateId":"5a4b03f0","name":"design patterns overview","description":"","formats":["XML","CSV","JSON","ARCHIMATE"],"source":"GitHub","repository":"wilmerkrisp/patterns","license":"Other","sourceFile":"raw-data/github/archimate/design_patterns_overview.archimate","sourceFormat":"ARCHIMATE","timestamp":"2023-07-06T09:29:17","tags":[],"duplicates":[],"language":"en","elements":[{"id":"2c37c934","name":"Business Object","type":"BusinessObject","layer":"business"},{"id":"14b58684","name":"4 Prototype","type":"Grouping","layer":"other"},{"id":"2aba2a80","name":"2 Builder","type":"Grouping","layer":"other"},{"id":"a15e4522","name":"Grouping","type":"Grouping","layer":"other"},{"id":"bc97dfcc","name":"3 Factory Method","type":"Grouping","layer":"other"},{"id":"e5bb37de","name":"1 Abstract Factory","type":"Grouping","layer":"other"},{"id":"ff7a6138","name":"Grouping","type":"Grouping","layer":"other"},{"id":"35ec24d7","name":"Grouping (copy)","type":"Grouping","layer":"other"},{"id":"5d42f1f1","name":"Grouping (copy)","type":"Grouping","layer":"other"},{"id":"c752e79a","name":"Grouping (copy)","type":"Grouping","layer":"other"},{"id":"ff5ee466","name":"5 Singleton","type":"Grouping","layer":"other"},{"id":"55041cbd","name":"Grouping (copy)","type":"Grouping","layer":"other"},{"id":"f37d4261","name":"Grouping (copy)","type":"Grouping","layer":"other"},{"id":"bb4d1f5f","name":"Grouping (copy)","type":"Grouping","layer":"other"},{"id":"d054d4ac","name":"Grouping (copy)","type":"Grouping","layer":"other"},{"id":"520e2be3","name":"4 Decorator","type":"Grouping","layer":"other"},{"id":"a216642c","name":"2 Bridge","type":"Grouping","layer":"other"},{"id":"bd081a0d","name":"3 Composite","type":"Grouping","layer":"other"},{"id":"47dfd9e0","name":"1 Adapter","type":"Grouping","layer":"other"},{"id":"a928f99c","name":"Grouping (copy) (copy)","type":"Grouping","layer":"other"},{"id":"9d40ed53","name":"6 Flyweight","type":"Grouping","layer":"other"},{"id":"341804e6","name":"7 Proxy","type":"Grouping","layer":"other"},{"id":"62887790","name":"5 Facade","type":"Grouping","layer":"other"},{"id":"c26b0508","name":"Grouping (copy) (copy)","type":"Grouping","layer":"other"},{"id":"3debbd1a","name":"Grouping (copy) (copy)","type":"Grouping","layer":"other"},{"id":"0f5228aa","name":"Grouping (copy) (copy)","type":"Grouping","layer":"other"},{"id":"62fdc3e4","name":"Grouping (copy) (copy)","type":"Grouping","layer":"other"},{"id":"af704474","name":"4 Iterator","type":"Grouping","layer":"other"},{"id":"dca50c4c","name":"2 Command","type":"Grouping","layer":"other"},{"id":"2fe44a0f","name":"3 Interpreter","type":"Grouping","layer":"other"},{"id":"b4fdf0d7","name":"1 Chain of Responsibility","type":"Grouping","layer":"other"},{"id":"4143c2d3","name":"8 State","type":"Grouping","layer":"other"},{"id":"dcd14142","name":"6 Memento","type":"Grouping","layer":"other"},{"id":"9fa9cb9d","name":"7 Observer","type":"Grouping","layer":"other"},{"id":"da148b31","name":"5 Mediator","type":"Grouping","layer":"other"},{"id":"a3b7933d","name":"Grouping (copy) (copy)","type":"Grouping","layer":"other"},{"id":"89f9be7e","name":"10 Template Method","type":"Grouping","layer":"other"},{"id":"a0aeeee5","name":"11 Visitor","type":"Grouping","layer":"other"},{"id":"9680dc3c","name":"9 Strategy","type":"Grouping","layer":"other"}],"relationships":[],"views":[{"id":"4b91674a","name":"map","viewpoint":""},{"id":"3d3b7211","name":"map (template temp)","viewpoint":""}]}