{"identifier":"https://me.big.tuwien.ac.at/EAModelSet/id-363d5e2d641f4975acd4fe60a0c5a2fb","archimateId":"id-363d5e2d641f4975acd4fe60a0c5a2fb","name":"heeus-ce-se","description":"","formats":["ARCHIMATE","XML","CSV","JSON"],"source":"GitHub","repository":"voedger/voedger","license":"MIT","sourceFile":"raw-data/github/archimate/heeus.archimate","sourceFormat":"ARCHIMATE","timestamp":"2024-02-21T01:38:16","tags":[],"duplicates":[],"language":"en","elements":[{"id":"id-08da35c089fb42f3b805cf5b9b111814","name":"HTTPProcessor","type":"TechnologyFunction","layer":"technology"},{"id":"id-d3e9b849ef934dbbb2b540e228e3f331","name":"HTTPProcessorController","type":"TechnologyFunction","layer":"technology"},{"id":"id-6a47fe3512f042ca98eb9e40eb3e545b","name":"cluster","type":"Artifact","layer":"technology"},{"id":"id-d7d1b8a1d3d647babe0caa44b908fbf0","name":"AppPartitions","type":"TechnologyFunction","layer":"technology"},{"id":"id-545fa4146ae245f5b2244df4e2fc6415","name":"AppPartition","type":"TechnologyFunction","layer":"technology"},{"id":"id-17a9dd37c5f146b78899870b1772f14b","name":"QueryProcessor","type":"TechnologyFunction","layer":"technology"},{"id":"id-e2f59ee5210b481595fa1743e47f30fd","name":"CommandProcessor","type":"TechnologyFunction","layer":"technology"},{"id":"id-50306169ace4429ebf634e7389077ca3","name":"AppPartitionsController","type":"TechnologyFunction","layer":"technology"},{"id":"id-798e7ed8c4894facb1313a89f8b5a38d","name":"FederationGateway","type":"TechnologyFunction","layer":"technology"},{"id":"id-cac88d766fd94952b2a9919c52c42634","name":"HTTPGateway","type":"TechnologyFunction","layer":"technology"},{"id":"id-46193ddd2c104b67a85ad1cbdf2991aa","name":"MailerGateway","type":"TechnologyFunction","layer":"technology"},{"id":"id-d4253bdffd944edab1776ccad52006ec","name":"IBus","type":"TechnologyFunction","layer":"technology"},{"id":"id-bdb15d498edc4925b82026c1bac1fe9d","name":"HTTPProcessorSender","type":"Path","layer":"technology"},{"id":"id-6b40a0d9184d41dc871a10406f33920d","name":"<owner>/<app>/c","type":"Path","layer":"technology"},{"id":"id-8a2d289ba1184b108bfa07e23fb63a10","name":"<owner>/<app>/q","type":"Path","layer":"technology"},{"id":"id-a1df316fc27e4c3ab1c6f667780ac4c4","name":"FederationGatewaySender","type":"Path","layer":"technology"},{"id":"id-a6db6eec345747bb991243a342164388","name":"HTTPGatewaySender","type":"Path","layer":"technology"},{"id":"id-4aba940b14d345e5800235142a188634","name":"MailerGatewaySender","type":"Path","layer":"technology"},{"id":"id-95d564172dcb4f82863d0359fd8a60e4","name":"Projector","type":"TechnologyFunction","layer":"technology"},{"id":"id-3643150b94644546b7cf8ecf7781f1a1","name":"FederationGatewayProcessor","type":"TechnologyFunction","layer":"technology"},{"id":"id-cf6edb9e5b644482bdb1a7893b95450e","name":"HTTPGatewayProcessor","type":"TechnologyFunction","layer":"technology"},{"id":"id-e199771eb7df49739c41af3be8150b62","name":"MailerGatewayProcessor","type":"TechnologyFunction","layer":"technology"},{"id":"id-c2098a0c528142088e989fb3dbd3872e","name":"Exporters/Importers","type":"Grouping","layer":"other"}],"relationships":[{"id":"id-3be8a0f10a0240feb9be9b2334d86fa9","sourceId":"id-d3e9b849ef934dbbb2b540e228e3f331","targetId":"id-08da35c089fb42f3b805cf5b9b111814","type":"Flow"},{"id":"id-5b8bfcdf9c5f4cb5bf5faa740a0f3e97","sourceId":"id-d3e9b849ef934dbbb2b540e228e3f331","targetId":"id-6a47fe3512f042ca98eb9e40eb3e545b","type":"Access"},{"id":"id-a4fde8bfcfc84fc98842743bc50b6798","sourceId":"id-d7d1b8a1d3d647babe0caa44b908fbf0","targetId":"id-545fa4146ae245f5b2244df4e2fc6415","type":"Aggregation"},{"id":"id-08a8046e267e4aedb094409b39793039","sourceId":"id-545fa4146ae245f5b2244df4e2fc6415","targetId":"id-e2f59ee5210b481595fa1743e47f30fd","type":"Aggregation"},{"id":"id-a8dc799e3f0f4eca8a5fb853f06c1f68","sourceId":"id-545fa4146ae245f5b2244df4e2fc6415","targetId":"id-17a9dd37c5f146b78899870b1772f14b","type":"Aggregation"},{"id":"id-e0918c19b68b4bb6ab477fddd963edd7","sourceId":"id-50306169ace4429ebf634e7389077ca3","targetId":"id-d7d1b8a1d3d647babe0caa44b908fbf0","type":"Flow"},{"id":"id-b9f70eeab48c4d47891ee4cc40afb750","sourceId":"id-50306169ace4429ebf634e7389077ca3","targetId":"id-6a47fe3512f042ca98eb9e40eb3e545b","type":"Access"},{"id":"id-5c90f8c16cea41d68e62d3e33d7b3972","sourceId":"id-d3e9b849ef934dbbb2b540e228e3f331","targetId":"id-bdb15d498edc4925b82026c1bac1fe9d","type":"Flow"},{"id":"id-82e71c34809e4bd9b686e05ddd7bb5ef","sourceId":"id-bdb15d498edc4925b82026c1bac1fe9d","targetId":"id-08da35c089fb42f3b805cf5b9b111814","type":"Flow"},{"id":"id-47e8fa7dd2b54ac69c1a77826cf51085","sourceId":"id-08da35c089fb42f3b805cf5b9b111814","targetId":"id-6b40a0d9184d41dc871a10406f33920d","type":"Flow"},{"id":"id-633361e014b6481b8d44edc568feb23a","sourceId":"id-08da35c089fb42f3b805cf5b9b111814","targetId":"id-8a2d289ba1184b108bfa07e23fb63a10","type":"Flow"},{"id":"id-fb2d126cfb1c44d185f757a228739b8a","sourceId":"id-6b40a0d9184d41dc871a10406f33920d","targetId":"id-e2f59ee5210b481595fa1743e47f30fd","type":"Flow"},{"id":"id-b6a4e1b6abe149f49233f6a530d4eb99","sourceId":"id-8a2d289ba1184b108bfa07e23fb63a10","targetId":"id-17a9dd37c5f146b78899870b1772f14b","type":"Flow"},{"id":"id-21a6a286e15849e2b3a518e36e3ae68b","sourceId":"id-d4253bdffd944edab1776ccad52006ec","targetId":"id-17a9dd37c5f146b78899870b1772f14b","type":"Serving"},{"id":"id-a9222e6b66fe4d18b02128afe04fbf92","sourceId":"id-545fa4146ae245f5b2244df4e2fc6415","targetId":"id-d4253bdffd944edab1776ccad52006ec","type":"Flow"},{"id":"id-f5587d87b66045cf98dce1aac343746c","sourceId":"id-d4253bdffd944edab1776ccad52006ec","targetId":"id-bdb15d498edc4925b82026c1bac1fe9d","type":"Association"},{"id":"id-2721060fbbc34d26a8d8332d59b6625d","sourceId":"id-d4253bdffd944edab1776ccad52006ec","targetId":"id-8a2d289ba1184b108bfa07e23fb63a10","type":"Association"},{"id":"id-bb747500cee7404599f4a93ae9ad82c3","sourceId":"id-d4253bdffd944edab1776ccad52006ec","targetId":"id-6b40a0d9184d41dc871a10406f33920d","type":"Association"},{"id":"id-4ce6c1bbebf74f6ca2167155cb4a849a","sourceId":"id-a1df316fc27e4c3ab1c6f667780ac4c4","targetId":"id-798e7ed8c4894facb1313a89f8b5a38d","type":"Flow"},{"id":"id-0d2a9d094c464c9eb39d71efe307a394","sourceId":"id-a6db6eec345747bb991243a342164388","targetId":"id-cac88d766fd94952b2a9919c52c42634","type":"Flow"},{"id":"id-a622c60fb33c4706a32702c9c36e30d8","sourceId":"id-4aba940b14d345e5800235142a188634","targetId":"id-46193ddd2c104b67a85ad1cbdf2991aa","type":"Flow"},{"id":"id-19eaa67639eb4b9fa16862532d6bf125","sourceId":"id-c2098a0c528142088e989fb3dbd3872e","targetId":"id-17a9dd37c5f146b78899870b1772f14b","type":"Aggregation"},{"id":"id-755bc720231f4c98b79f0d23dd696acd","sourceId":"id-c2098a0c528142088e989fb3dbd3872e","targetId":"id-a1df316fc27e4c3ab1c6f667780ac4c4","type":"Flow"},{"id":"id-e248c0da4d7949b28058584484278423","sourceId":"id-c2098a0c528142088e989fb3dbd3872e","targetId":"id-a6db6eec345747bb991243a342164388","type":"Flow"},{"id":"id-1fc35c65c3e7453ea99832b20e1f2154","sourceId":"id-c2098a0c528142088e989fb3dbd3872e","targetId":"id-4aba940b14d345e5800235142a188634","type":"Flow"},{"id":"id-d888131eda0e463b8da39a1d18fd2619","sourceId":"id-545fa4146ae245f5b2244df4e2fc6415","targetId":"id-95d564172dcb4f82863d0359fd8a60e4","type":"Aggregation"},{"id":"id-457135c4a8ed4dd1871bdfa76f7d4ec0","sourceId":"id-c2098a0c528142088e989fb3dbd3872e","targetId":"id-95d564172dcb4f82863d0359fd8a60e4","type":"Aggregation"},{"id":"id-9356cd8f81774e6ba265b4b853b4b9a4","sourceId":"id-798e7ed8c4894facb1313a89f8b5a38d","targetId":"id-3643150b94644546b7cf8ecf7781f1a1","type":"Composition"},{"id":"id-08a6c7104e2d4670aa5a054442d2ae87","sourceId":"id-cac88d766fd94952b2a9919c52c42634","targetId":"id-cf6edb9e5b644482bdb1a7893b95450e","type":"Composition"},{"id":"id-240f5d024ca14ea89c8fc75f3ced82e0","sourceId":"id-46193ddd2c104b67a85ad1cbdf2991aa","targetId":"id-e199771eb7df49739c41af3be8150b62","type":"Composition"}],"views":[{"id":"id-7702051add304ddbb8c0118d47e29cc1","name":"00-Processors & Gateways","viewpoint":""},{"id":"id-4b0fd28edfb343959fcdaba46273b69a","name":"z-Bookmarks","viewpoint":""},{"id":"id-f1b95ed73583436596cdb84a8c1dd3a9","name":"20-HTTPProcessor & Bus","viewpoint":""},{"id":"id-55391af1cc22490290ae0f179fe5919e","name":"30-Gateways & Bus","viewpoint":""}]}