{"identifier":"https://me.big.tuwien.ac.at/EAModelSet/_ay028PGjEeqygJczXaaxEQ","archimateId":"_ay028PGjEeqygJczXaaxEQ","name":"payments-arch","description":"","formats":["XML","CSV","JSON","ARCHIMATE"],"source":"GenMyModel","repository":"","license":"","sourceFile":"raw-data/genmymodel/_ay028pgjeeqygjczxaaxeq.xml","sourceFormat":"XML","timestamp":"2023-07-06T10:01:17","tags":[],"duplicates":[],"language":"en","elements":[{"id":"_nntn8NPREDiUdI4HmtuzBA","name":"WebForm Custom","type":"ApplicationService","layer":"application"},{"id":"_tJ9IgNPREDiUdI4HmtuzBA","name":"WebHook Public Node","type":"ApplicationService","layer":"application"},{"id":"_7kHE8NPREDiUdI4HmtuzBA","name":"CloudPayments","type":"ApplicationService","layer":"application"},{"id":"_9wT2wNPREDiUdI4HmtuzBA","name":"others","type":"ApplicationService","layer":"application"},{"id":"_NZlRsNPSEDiUdI4HmtuzBA","name":"Software","type":"SystemSoftware","layer":"technology"},{"id":"_OrvdINPSEDiUdI4HmtuzBA","name":"Collaboration","type":"BusinessCollaboration","layer":"business"},{"id":"_Qzw5kNPSEDiUdI4HmtuzBA","name":"Event Pub\\Sub Bus","type":"SystemSoftware","layer":"technology"},{"id":"_YGh8kNPSEDiUdI4HmtuzBA","name":"App","type":"ApplicationService","layer":"application"},{"id":"_lszlANPSEDiUdI4HmtuzBA","name":"General Store","type":"TechnologyCollaboration","layer":"technology"},{"id":"_pYxgcNPSEDiUdI4HmtuzBA","name":"Internal Store","type":"TechnologyCollaboration","layer":"technology"},{"id":"_sg350NPSEDiUdI4HmtuzBA","name":"Collaboration","type":"TechnologyCollaboration","layer":"technology"},{"id":"_u3o84NPSEDiUdI4HmtuzBA","name":"Core Service","type":"ApplicationService","layer":"application"},{"id":"_wp2hYNPSEDiUdI4HmtuzBA","name":"Internal store","type":"TechnologyCollaboration","layer":"technology"},{"id":"_0a8NYNPSEDiUdI4HmtuzBA","name":"Http Adapter service","type":"ApplicationService","layer":"application"},{"id":"_FHK6INPTEDiUdI4HmtuzBA","name":"Api Adapter service","type":"ApplicationService","layer":"application"},{"id":"_LzyjINPTEDiUdI4HmtuzBA","name":"Event Bus Adapter","type":"ApplicationService","layer":"application"},{"id":"_1q9uANPWEDiUdI4HmtuzBA","name":"Service","type":"ApplicationService","layer":"application"},{"id":"_3Q-CgNPWEDiUdI4HmtuzBA","name":"Http Form Service","type":"ApplicationService","layer":"application"}],"relationships":[{"id":"_EbQr0NPSEDiUdI4HmtuzBA","sourceId":"_7kHE8NPREDiUdI4HmtuzBA","targetId":"_tJ9IgNPREDiUdI4HmtuzBA","type":"Serving"},{"id":"_2hXHUNPSEDiUdI4HmtuzBA","sourceId":"_tJ9IgNPREDiUdI4HmtuzBA","targetId":"_0a8NYNPSEDiUdI4HmtuzBA","type":"Serving"},{"id":"_27I5QNPSEDiUdI4HmtuzBA","sourceId":"_nntn8NPREDiUdI4HmtuzBA","targetId":"_0a8NYNPSEDiUdI4HmtuzBA","type":"Serving"},{"id":"_3r_HYNPSEDiUdI4HmtuzBA","sourceId":"_0a8NYNPSEDiUdI4HmtuzBA","targetId":"_u3o84NPSEDiUdI4HmtuzBA","type":"Serving"},{"id":"_4xn5wNPSEDiUdI4HmtuzBA","sourceId":"_u3o84NPSEDiUdI4HmtuzBA","targetId":"_0a8NYNPSEDiUdI4HmtuzBA","type":"Serving"},{"id":"_7SwZwNPSEDiUdI4HmtuzBA","sourceId":"_0a8NYNPSEDiUdI4HmtuzBA","targetId":"_nntn8NPREDiUdI4HmtuzBA","type":"Serving"},{"id":"___pmsNPSEDiUdI4HmtuzBA","sourceId":"_u3o84NPSEDiUdI4HmtuzBA","targetId":"_wp2hYNPSEDiUdI4HmtuzBA","type":"Serving"},{"id":"_AeT4oNPTEDiUdI4HmtuzBA","sourceId":"_wp2hYNPSEDiUdI4HmtuzBA","targetId":"_u3o84NPSEDiUdI4HmtuzBA","type":"Serving"},{"id":"_B1qtINPTEDiUdI4HmtuzBA","sourceId":"_u3o84NPSEDiUdI4HmtuzBA","targetId":"_lszlANPSEDiUdI4HmtuzBA","type":"Serving"},{"id":"_CTMWoNPTEDiUdI4HmtuzBA","sourceId":"_lszlANPSEDiUdI4HmtuzBA","targetId":"_u3o84NPSEDiUdI4HmtuzBA","type":"Serving"},{"id":"_GkeloNPTEDiUdI4HmtuzBA","sourceId":"_YGh8kNPSEDiUdI4HmtuzBA","targetId":"_FHK6INPTEDiUdI4HmtuzBA","type":"Serving"},{"id":"_H1apENPTEDiUdI4HmtuzBA","sourceId":"_FHK6INPTEDiUdI4HmtuzBA","targetId":"_YGh8kNPSEDiUdI4HmtuzBA","type":"Serving"},{"id":"_JDjQINPTEDiUdI4HmtuzBA","sourceId":"_FHK6INPTEDiUdI4HmtuzBA","targetId":"_u3o84NPSEDiUdI4HmtuzBA","type":"Serving"},{"id":"_Jb9JENPTEDiUdI4HmtuzBA","sourceId":"_u3o84NPSEDiUdI4HmtuzBA","targetId":"_FHK6INPTEDiUdI4HmtuzBA","type":"Serving"},{"id":"_NyIfINPTEDiUdI4HmtuzBA","sourceId":"_u3o84NPSEDiUdI4HmtuzBA","targetId":"_LzyjINPTEDiUdI4HmtuzBA","type":"Serving"},{"id":"_ONEHoNPTEDiUdI4HmtuzBA","sourceId":"_LzyjINPTEDiUdI4HmtuzBA","targetId":"_Qzw5kNPSEDiUdI4HmtuzBA","type":"Serving"},{"id":"_fBKW8NPTEDiUdI4HmtuzBA","sourceId":"_Qzw5kNPSEDiUdI4HmtuzBA","targetId":"_YGh8kNPSEDiUdI4HmtuzBA","type":"Serving"},{"id":"_zRYH0NPTEDiUdI4HmtuzBA","sourceId":"_u3o84NPSEDiUdI4HmtuzBA","targetId":"_7kHE8NPREDiUdI4HmtuzBA","type":"Serving"},{"id":"_8Ey94NPWEDiUdI4HmtuzBA","sourceId":"_nntn8NPREDiUdI4HmtuzBA","targetId":"_3Q-CgNPWEDiUdI4HmtuzBA","type":"Serving"},{"id":"_8mcSYNPWEDiUdI4HmtuzBA","sourceId":"_3Q-CgNPWEDiUdI4HmtuzBA","targetId":"_u3o84NPSEDiUdI4HmtuzBA","type":"Serving"}],"views":[{"id":"_ay028_GjEeqygJczXaaxEQ","name":"archimate-diagram","viewpoint":""}]}