{"identifier":"https://me.big.tuwien.ac.at/EAModelSet/1d703f78","archimateId":"1d703f78","name":"everything","description":"\n# Purpose\n\nThis **ArchiMate** Model is here to illustrate the abilty to use [Markdown](https://daringfireball.net/projects/markdown/)\nfor markup in *Documentation* tags.\n\n* lists\n* lists\n* lists\n\nYou also include code examples:\n\n    // Code examples\n    while (true) {\n      this.burnCpu();\n    }\n\n  ","formats":["XML","CSV","JSON","ARCHIMATE"],"source":"GitHub","repository":"mmorga/archimate-diff","license":"Apache License 2.0","sourceFile":"raw-data/github/archimate/everything.archimate","sourceFormat":"ARCHIMATE","timestamp":"2023-07-06T09:29:17","tags":["WARNING"],"duplicates":[],"language":"en","elements":[{"id":"895b5ec5","name":"Business Actor","type":"BusinessActor","layer":"business"},{"id":"d1a45f58","name":"Business Role","type":"BusinessRole","layer":"business"},{"id":"b6677ae1","name":"Business Collaboration","type":"BusinessCollaboration","layer":"business"},{"id":"bc1ceb46","name":"Business Interface","type":"BusinessInterface","layer":"business"},{"id":"15e2172c","name":"Business Function","type":"BusinessFunction","layer":"business"},{"id":"70630355","name":"Business Process","type":"BusinessProcess","layer":"business"},{"id":"cfffd652","name":"Business Event","type":"BusinessEvent","layer":"business"},{"id":"2a00fdf3","name":"Business Interaction","type":"BusinessInteraction","layer":"business"},{"id":"f0090d70","name":"Product","type":"Product","layer":"business"},{"id":"03064f37","name":"Contract","type":"Contract","layer":"business"},{"id":"b5dd94c9","name":"Business Service","type":"BusinessService","layer":"business"},{"id":"ab4c4726","name":"Representation of us and all of that","type":"Representation","layer":"business"},{"id":"e1616652","name":"Business Object","type":"BusinessObject","layer":"business"},{"id":"11af7615","name":"Business Interface","type":"BusinessInterface","layer":"business"},{"id":"d393c534","name":"Business Process","type":"BusinessProcess","layer":"business"},{"id":"495250a2","name":"Business Service","type":"BusinessService","layer":"business"},{"id":"f123a9d3","name":"Business Actor","type":"BusinessActor","layer":"business"},{"id":"e7c1a5f3","name":"Business Process","type":"BusinessProcess","layer":"business"},{"id":"867c2f22","name":"Business Process","type":"BusinessProcess","layer":"business"},{"id":"890c6b06","name":"Business Event hello red fish blue fish","type":"BusinessEvent","layer":"business"},{"id":"4e337ab3","name":"Application Component","type":"ApplicationComponent","layer":"application"},{"id":"a3965597","name":"Application Collaboration","type":"ApplicationCollaboration","layer":"application"},{"id":"72abc76d","name":"Application Interface","type":"ApplicationInterface","layer":"application"},{"id":"e5504f30","name":"Application Service","type":"ApplicationService","layer":"application"},{"id":"9b0af2d9","name":"Application Function","type":"ApplicationFunction","layer":"application"},{"id":"51eecad7","name":"Application Interaction","type":"ApplicationInteraction","layer":"application"},{"id":"75a63568","name":"Data Object","type":"DataObject","layer":"application"},{"id":"2f331587","name":"Application Component","type":"ApplicationComponent","layer":"application"},{"id":"8b0269a0","name":"Application Interface","type":"ApplicationInterface","layer":"application"},{"id":"c50ea139","name":"Application Service","type":"ApplicationService","layer":"application"},{"id":"0fd56a64-8ee7-4777-93e3-2fd4ae66fe2b","name":"Application Event","type":"ApplicationEvent","layer":"application"},{"id":"1c8c458d-7c1a-4424-b3bd-ff236bd9888b","name":"Application Process","type":"ApplicationProcess","layer":"application"},{"id":"a58c2cff","name":"Artifact that I found one day","type":"Artifact","layer":"technology"},{"id":"61b2ebb6","name":"Communication Path","type":"Path","layer":"technology"},{"id":"b55b532f","name":"Network","type":"CommunicationNetwork","layer":"technology"},{"id":"f5bb4733","name":"Infrastructure Interface","type":"TechnologyInterface","layer":"technology"},{"id":"c3b8630a","name":"Infrastructure Function","type":"TechnologyFunction","layer":"technology"},{"id":"1637e896","name":"Infrastructure Service","type":"TechnologyService","layer":"technology"},{"id":"7eacfc0f","name":"Node","type":"Node","layer":"technology"},{"id":"5d63c4ac","name":"System Software","type":"SystemSoftware","layer":"technology"},{"id":"78f8493b","name":"Device","type":"Device","layer":"technology"},{"id":"7d72249a","name":"Infrastructure Interface","type":"TechnologyInterface","layer":"technology"},{"id":"a11b9eb7","name":"Infrastructure Service","type":"TechnologyService","layer":"technology"},{"id":"fa48c0eb","name":"Node","type":"Node","layer":"technology"},{"id":"89d89ded","name":"Device","type":"Device","layer":"technology"},{"id":"1ef2b6b0","name":"Stakeholder","type":"Stakeholder","layer":"motivation"},{"id":"49f1b964","name":"Driver","type":"Driver","layer":"motivation"},{"id":"21876b7e","name":"Assessment","type":"Assessment","layer":"motivation"},{"id":"35d27705","name":"Goal","type":"Goal","layer":"motivation"},{"id":"4a1a1a71","name":"Principle","type":"Principle","layer":"motivation"},{"id":"529a4b14","name":"Requirement","type":"Requirement","layer":"motivation"},{"id":"da7394bd","name":"Constraint","type":"Constraint","layer":"motivation"},{"id":"5ce14ef5","name":"Value of some thing","type":"Value","layer":"motivation"},{"id":"b9d8f495","name":"Meaning","type":"Meaning","layer":"motivation"},{"id":"77fa0664","name":"Work Package","type":"WorkPackage","layer":"implementation_migration"},{"id":"0e8739c2","name":"Deliverable","type":"Deliverable","layer":"implementation_migration"},{"id":"d89ba03a","name":"Plateau","type":"Plateau","layer":"implementation_migration"},{"id":"9005d244","name":"Gap","type":"Gap","layer":"implementation_migration"},{"id":"1bbf9386","name":"Junction","type":"Junction","layer":"other"},{"id":"2b5667ad","name":"And Junction","type":"Junction","layer":"other"},{"id":"a3344375","name":"Or Junction","type":"Junction","layer":"other"},{"id":"d8440883","name":"Location","type":"Location","layer":"other"},{"id":"5f48a3fc-7864-4e9e-ac2b-3f6f1e6a0344","name":"Grouping","type":"Grouping","layer":"other"}],"relationships":[{"id":"56731509","sourceId":"21876b7e","targetId":"35d27705","type":"Influence"},{"id":"4e16546f","sourceId":"fa48c0eb","targetId":"7eacfc0f","type":"Specialization"},{"id":"c8c82c51","sourceId":"495250a2","targetId":"b5dd94c9","type":"Composition"},{"id":"c8a3de09","sourceId":"11af7615","targetId":"bc1ceb46","type":"Aggregation"},{"id":"060a4402","sourceId":"895b5ec5","targetId":"d1a45f58","type":"Assignment"},{"id":"c181b0c6","sourceId":"15e2172c","targetId":"b5dd94c9","type":"Realization"},{"id":"065064e2","sourceId":"cfffd652","targetId":"2a00fdf3","type":"Triggering"},{"id":"43c00467","sourceId":"2a00fdf3","targetId":"a3965597","type":"Flow"},{"id":"d1290848","sourceId":"61b2ebb6","targetId":"b55b532f","type":"Association"},{"id":"277e36e1","sourceId":"15e2172c","targetId":"03064f37","type":"Access"},{"id":"03bc5201","sourceId":"4e337ab3","targetId":"e5504f30","type":"Serving"},{"id":"d9cb9327","sourceId":"70630355","targetId":"1bbf9386","type":"Flow"},{"id":"2111dd5e","sourceId":"1bbf9386","targetId":"d393c534","type":"Flow"},{"id":"6e0561fa","sourceId":"70630355","targetId":"a3344375","type":"Flow"},{"id":"6f36fe71","sourceId":"a3344375","targetId":"e7c1a5f3","type":"Flow"},{"id":"0f76942c","sourceId":"a3344375","targetId":"867c2f22","type":"Flow"},{"id":"1a162973","sourceId":"e7c1a5f3","targetId":"2b5667ad","type":"Flow"},{"id":"06a30a60","sourceId":"1bbf9386","targetId":"867c2f22","type":"Flow"},{"id":"1316e37d","sourceId":"867c2f22","targetId":"2b5667ad","type":"Flow"},{"id":"17250bc3","sourceId":"2b5667ad","targetId":"890c6b06","type":"Triggering"},{"id":"01497e63-4bef-4e9b-b6b2-2b5af4852d34","sourceId":"5f48a3fc-7864-4e9e-ac2b-3f6f1e6a0344","targetId":"5ce14ef5","type":"Composition"}],"views":[{"id":"3b1325ab","name":"Everything","viewpoint":""},{"id":"e0d837de-1ad4-4677-9112-fedf0d46aa07","name":"Referenced By Everything","viewpoint":""}]}