{"identifier":"https://me.big.tuwien.ac.at/EAModelSet/_d2MGQIGDEeyiydZsM2RdLg","archimateId":"_d2MGQIGDEeyiydZsM2RdLg","name":"Electronic Ticketing Genealogy","description":"","formats":["XML","CSV","JSON","ARCHIMATE"],"source":"GenMyModel","repository":"","license":"","sourceFile":"raw-data/genmymodel/_d2mgqigdeeyiydzsm2rdlg.xml","sourceFormat":"XML","timestamp":"2023-07-06T10:01:18","tags":[],"duplicates":[],"language":"fr","elements":[{"id":"_flbjEGOyEDqZK4-iqDQE1w","name":"Super Admin","type":"BusinessActor","layer":"business"},{"id":"_g_5V8GOyEDqZK4-iqDQE1w","name":"Admin","type":"BusinessActor","layer":"business"},{"id":"_0S-wMGOyEDqZK4-iqDQE1w","name":"DevOps","type":"BusinessActor","layer":"business"},{"id":"_7rrcEGOyEDqZK4-iqDQE1w","name":"Admin","type":"BusinessActor","layer":"business"},{"id":"_8P2gIGOyEDqZK4-iqDQE1w","name":"Admin","type":"BusinessActor","layer":"business"},{"id":"_AvYmgGOzEDqZK4-iqDQE1w","name":"Manager","type":"BusinessActor","layer":"business"},{"id":"_Q8JwEGOzEDqZK4-iqDQE1w","name":"Manager","type":"BusinessActor","layer":"business"},{"id":"_SpdmcGOzEDqZK4-iqDQE1w","name":"Manager","type":"BusinessActor","layer":"business"},{"id":"_V_26gGOzEDqZK4-iqDQE1w","name":"Manager","type":"BusinessActor","layer":"business"},{"id":"_V_26gmOzEDqZK4-iqDQE1w","name":"Manager","type":"BusinessActor","layer":"business"},{"id":"_XPJYIGOzEDqZK4-iqDQE1w","name":"Agent","type":"BusinessActor","layer":"business"},{"id":"_XPJYImOzEDqZK4-iqDQE1w","name":"Manager","type":"BusinessActor","layer":"business"},{"id":"_XPJYJGOzEDqZK4-iqDQE1w","name":"Manager","type":"BusinessActor","layer":"business"},{"id":"_abjCsGOzEDqZK4-iqDQE1w","name":"Agent","type":"BusinessActor","layer":"business"},{"id":"_abjpwWOzEDqZK4-iqDQE1w","name":"Manager","type":"BusinessActor","layer":"business"},{"id":"_abjpw2OzEDqZK4-iqDQE1w","name":"Manager","type":"BusinessActor","layer":"business"},{"id":"_a2ui0GOzEDqZK4-iqDQE1w","name":"Agent","type":"BusinessActor","layer":"business"},{"id":"_a2ui0mOzEDqZK4-iqDQE1w","name":"Manager","type":"BusinessActor","layer":"business"},{"id":"_a2ui1GOzEDqZK4-iqDQE1w","name":"Manager","type":"BusinessActor","layer":"business"},{"id":"_bNom8GOzEDqZK4-iqDQE1w","name":"Agent","type":"BusinessActor","layer":"business"},{"id":"_bNom8mOzEDqZK4-iqDQE1w","name":"Manager","type":"BusinessActor","layer":"business"},{"id":"_bNom9GOzEDqZK4-iqDQE1w","name":"Manager","type":"BusinessActor","layer":"business"},{"id":"_bsEPYGOzEDqZK4-iqDQE1w","name":"Agent","type":"BusinessActor","layer":"business"},{"id":"_bsEPYmOzEDqZK4-iqDQE1w","name":"Manager","type":"BusinessActor","layer":"business"},{"id":"_bsEPZGOzEDqZK4-iqDQE1w","name":"Manager","type":"BusinessActor","layer":"business"},{"id":"_cEU-YGOzEDqZK4-iqDQE1w","name":"Agent","type":"BusinessActor","layer":"business"},{"id":"_cEU-YmOzEDqZK4-iqDQE1w","name":"Manager","type":"BusinessActor","layer":"business"},{"id":"_cEU-ZGOzEDqZK4-iqDQE1w","name":"Manager","type":"BusinessActor","layer":"business"},{"id":"_ceDtAGOzEDqZK4-iqDQE1w","name":"Agent","type":"BusinessActor","layer":"business"},{"id":"_ceDtAmOzEDqZK4-iqDQE1w","name":"Manager","type":"BusinessActor","layer":"business"},{"id":"_ceDtBGOzEDqZK4-iqDQE1w","name":"Manager","type":"BusinessActor","layer":"business"},{"id":"_c0PYYGOzEDqZK4-iqDQE1w","name":"Agent","type":"BusinessActor","layer":"business"},{"id":"_c0P_cGOzEDqZK4-iqDQE1w","name":"Manager","type":"BusinessActor","layer":"business"},{"id":"_c0P_cmOzEDqZK4-iqDQE1w","name":"Manager","type":"BusinessActor","layer":"business"},{"id":"_ZHidIGOzEDqZK4-iqDQE1w","name":"Agent","type":"BusinessActor","layer":"business"},{"id":"_ZHidImOzEDqZK4-iqDQE1w","name":"Manager","type":"BusinessActor","layer":"business"},{"id":"_ZHidJGOzEDqZK4-iqDQE1w","name":"Manager","type":"BusinessActor","layer":"business"},{"id":"_mxdPcGOzEDqZK4-iqDQE1w","name":"Ticket Sales","type":"BusinessService","layer":"business"},{"id":"_YeM2IGO8EDqFW-jzZ2nkDg","name":"indipendent participants","type":"BusinessActor","layer":"business"}],"relationships":[{"id":"_ymarQGOzEDqZK4-iqDQE1w","sourceId":"_c0PYYGOzEDqZK4-iqDQE1w","targetId":"_V_26gGOzEDqZK4-iqDQE1w","type":"Serving"},{"id":"_lA9WoGO9EDqFW-jzZ2nkDg","sourceId":"_ceDtAGOzEDqZK4-iqDQE1w","targetId":"_SpdmcGOzEDqZK4-iqDQE1w","type":"Serving"},{"id":"_gKcToGO9EDqFW-jzZ2nkDg","sourceId":"_cEU-YGOzEDqZK4-iqDQE1w","targetId":"_SpdmcGOzEDqZK4-iqDQE1w","type":"Serving"},{"id":"_cnxeIGO9EDqFW-jzZ2nkDg","sourceId":"_bsEPYGOzEDqZK4-iqDQE1w","targetId":"_SpdmcGOzEDqZK4-iqDQE1w","type":"Serving"},{"id":"_iSpWQGO9EDqFW-jzZ2nkDg","sourceId":"_bNom8GOzEDqZK4-iqDQE1w","targetId":"_SpdmcGOzEDqZK4-iqDQE1w","type":"Serving"},{"id":"_vXhh0GO9EDqFW-jzZ2nkDg","sourceId":"_a2ui0GOzEDqZK4-iqDQE1w","targetId":"_Q8JwEGOzEDqZK4-iqDQE1w","type":"Serving"},{"id":"_wB1DEGO9EDqFW-jzZ2nkDg","sourceId":"_abjCsGOzEDqZK4-iqDQE1w","targetId":"_Q8JwEGOzEDqZK4-iqDQE1w","type":"Serving"},{"id":"_kBUqIGOzEDqZK4-iqDQE1w","sourceId":"_AvYmgGOzEDqZK4-iqDQE1w","targetId":"_g_5V8GOyEDqZK4-iqDQE1w","type":"Serving"},{"id":"_vRTwoGOzEDqZK4-iqDQE1w","sourceId":"_mxdPcGOzEDqZK4-iqDQE1w","targetId":"_c0PYYGOzEDqZK4-iqDQE1w","type":"Serving"},{"id":"_4zi74GOzEDqZK4-iqDQE1w","sourceId":"_mxdPcGOzEDqZK4-iqDQE1w","targetId":"_V_26gGOzEDqZK4-iqDQE1w","type":"Serving"},{"id":"_7S7vcGOzEDqZK4-iqDQE1w","sourceId":"_mxdPcGOzEDqZK4-iqDQE1w","targetId":"_8P2gIGOyEDqZK4-iqDQE1w","type":"Serving"},{"id":"_QA-EwGO0EDqnYsduVKC8Gw","sourceId":"_8P2gIGOyEDqZK4-iqDQE1w","targetId":"_flbjEGOyEDqZK4-iqDQE1w","type":"Serving"},{"id":"_vNqQoGO8EDqFW-jzZ2nkDg","sourceId":"_YeM2IGO8EDqFW-jzZ2nkDg","targetId":"_mxdPcGOzEDqZK4-iqDQE1w","type":"Flow"},{"id":"_wYGDcGO8EDqFW-jzZ2nkDg","sourceId":"_mxdPcGOzEDqZK4-iqDQE1w","targetId":"_0S-wMGOyEDqZK4-iqDQE1w","type":"Flow"},{"id":"_pWOtwGO9EDqFW-jzZ2nkDg","sourceId":"_mxdPcGOzEDqZK4-iqDQE1w","targetId":"_bsEPYGOzEDqZK4-iqDQE1w","type":"Flow"},{"id":"_qgp5gGO9EDqFW-jzZ2nkDg","sourceId":"_mxdPcGOzEDqZK4-iqDQE1w","targetId":"_cEU-YGOzEDqZK4-iqDQE1w","type":"Flow"},{"id":"_rnuPQGO9EDqFW-jzZ2nkDg","sourceId":"_mxdPcGOzEDqZK4-iqDQE1w","targetId":"_bNom8GOzEDqZK4-iqDQE1w","type":"Flow"},{"id":"_sEgR4GO9EDqFW-jzZ2nkDg","sourceId":"_mxdPcGOzEDqZK4-iqDQE1w","targetId":"_ceDtAGOzEDqZK4-iqDQE1w","type":"Flow"},{"id":"_s1jUUGO9EDqFW-jzZ2nkDg","sourceId":"_SpdmcGOzEDqZK4-iqDQE1w","targetId":"_7rrcEGOyEDqZK4-iqDQE1w","type":"Serving"},{"id":"_ukCPYGO9EDqFW-jzZ2nkDg","sourceId":"_mxdPcGOzEDqZK4-iqDQE1w","targetId":"_a2ui0GOzEDqZK4-iqDQE1w","type":"Flow"},{"id":"_xKfUQGO9EDqFW-jzZ2nkDg","sourceId":"_XPJYIGOzEDqZK4-iqDQE1w","targetId":"_AvYmgGOzEDqZK4-iqDQE1w","type":"Serving"},{"id":"_xzfN8GO9EDqFW-jzZ2nkDg","sourceId":"_ZHidIGOzEDqZK4-iqDQE1w","targetId":"_AvYmgGOzEDqZK4-iqDQE1w","type":"Serving"},{"id":"_zVwR8GO9EDqFW-jzZ2nkDg","sourceId":"_mxdPcGOzEDqZK4-iqDQE1w","targetId":"_XPJYIGOzEDqZK4-iqDQE1w","type":"Flow"},{"id":"_0NM3UGO9EDqFW-jzZ2nkDg","sourceId":"_mxdPcGOzEDqZK4-iqDQE1w","targetId":"_abjCsGOzEDqZK4-iqDQE1w","type":"Flow"},{"id":"_0zbw4GO9EDqFW-jzZ2nkDg","sourceId":"_mxdPcGOzEDqZK4-iqDQE1w","targetId":"_ZHidIGOzEDqZK4-iqDQE1w","type":"Flow"},{"id":"_6oanQGO9EDqFW-jzZ2nkDg","sourceId":"_Q8JwEGOzEDqZK4-iqDQE1w","targetId":"_g_5V8GOyEDqZK4-iqDQE1w","type":"Serving"}],"views":[{"id":"_d2MGQ4GDEeyiydZsM2RdLg","name":"archimate-diagram","viewpoint":""}]}