{"identifier":"https://me.big.tuwien.ac.at/EAModelSet/_AZb0kKziEe2vW5IAILnJcQ","archimateId":"_AZb0kKziEe2vW5IAILnJcQ","name":"D1","description":"","formats":["XML","CSV","JSON","ARCHIMATE"],"source":"GenMyModel","repository":"","license":"","sourceFile":"raw-data/genmymodel/_azb0kkziee2vw5iailnjcq.xml","sourceFormat":"XML","timestamp":"2023-07-06T10:01:17","tags":[],"duplicates":[],"language":"es","elements":[{"id":"_aT4bsI8SEDuemesZNDqwog","name":"Comprador","type":"BusinessActor","layer":"business"},{"id":"_bflZ0I8SEDuemesZNDqwog","name":"S1-Abastecimiento productos","type":"BusinessService","layer":"business"},{"id":"_gcTygI8SEDuemesZNDqwog","name":"Proveedor","type":"BusinessActor","layer":"business"},{"id":"_hhX9II8SEDuemesZNDqwog","name":"Empleado","type":"BusinessActor","layer":"business"},{"id":"_x9ntII8SEDuemesZNDqwog","name":"S2-Obtener productos mediante      las tiendas físicas ","type":"BusinessService","layer":"business"},{"id":"_08R2oI8SEDuemesZNDqwog","name":"S3-Atención al cliente durante la selección de productos","type":"BusinessService","layer":"business"},{"id":"_giTa4I8UEDuemesZNDqwog","name":"Creador","type":"BusinessActor","layer":"business"},{"id":"_ib2WcI8UEDuemesZNDqwog","name":"Backer","type":"BusinessActor","layer":"business"},{"id":"_uJaJwI8UEDuemesZNDqwog","name":"Subir proyecto","type":"BusinessService","layer":"business"},{"id":"_vXftgI8UEDuemesZNDqwog","name":"Apoyar proyecto","type":"BusinessService","layer":"business"},{"id":"_WuilUI8VEDuemesZNDqwog","name":"Plataforma","type":"BusinessObject","layer":"business"},{"id":"_co1ZgI8VEDuemesZNDqwog","name":"Bien Físico o Digital","type":"BusinessObject","layer":"business"},{"id":"_xJcW0I8VEDuemesZNDqwog","name":"Productos físicos de terceros","type":"BusinessObject","layer":"business"},{"id":"_KfRWoI8WEDuemesZNDqwog","name":"Servicio: Atención al cliente ","type":"BusinessObject","layer":"business"}],"relationships":[{"id":"_AT-HoI8TEDuemesZNDqwog","sourceId":"_hhX9II8SEDuemesZNDqwog","targetId":"_08R2oI8SEDuemesZNDqwog","type":"Assignment"},{"id":"_BQyVMI8TEDuemesZNDqwog","sourceId":"_hhX9II8SEDuemesZNDqwog","targetId":"_08R2oI8SEDuemesZNDqwog","type":"Triggering"},{"id":"_DhyHcI8TEDuemesZNDqwog","sourceId":"_hhX9II8SEDuemesZNDqwog","targetId":"_08R2oI8SEDuemesZNDqwog","type":"Assignment"},{"id":"_epR5MI8TEDuemesZNDqwog","sourceId":"_aT4bsI8SEDuemesZNDqwog","targetId":"_x9ntII8SEDuemesZNDqwog","type":"Association"},{"id":"_fdngMI8TEDuemesZNDqwog","sourceId":"_aT4bsI8SEDuemesZNDqwog","targetId":"_x9ntII8SEDuemesZNDqwog","type":"Serving"},{"id":"_gXtw8I8TEDuemesZNDqwog","sourceId":"_aT4bsI8SEDuemesZNDqwog","targetId":"_x9ntII8SEDuemesZNDqwog","type":"Flow"},{"id":"_hEA2QI8TEDuemesZNDqwog","sourceId":"_aT4bsI8SEDuemesZNDqwog","targetId":"_x9ntII8SEDuemesZNDqwog","type":"Assignment"},{"id":"_kUwOQI8TEDuemesZNDqwog","sourceId":"_aT4bsI8SEDuemesZNDqwog","targetId":"_x9ntII8SEDuemesZNDqwog","type":"Realization"},{"id":"_llmyII8TEDuemesZNDqwog","sourceId":"_aT4bsI8SEDuemesZNDqwog","targetId":"_x9ntII8SEDuemesZNDqwog","type":"Realization"},{"id":"_mU3r4I8TEDuemesZNDqwog","sourceId":"_aT4bsI8SEDuemesZNDqwog","targetId":"_x9ntII8SEDuemesZNDqwog","type":"Triggering"},{"id":"_nVKEMI8TEDuemesZNDqwog","sourceId":"_aT4bsI8SEDuemesZNDqwog","targetId":"_x9ntII8SEDuemesZNDqwog","type":"Assignment"},{"id":"_qc208I8TEDuemesZNDqwog","sourceId":"_gcTygI8SEDuemesZNDqwog","targetId":"_bflZ0I8SEDuemesZNDqwog","type":"Assignment"},{"id":"_wuYA4I8UEDuemesZNDqwog","sourceId":"_giTa4I8UEDuemesZNDqwog","targetId":"_uJaJwI8UEDuemesZNDqwog","type":"Association"},{"id":"_8p8bAI8UEDuemesZNDqwog","sourceId":"_giTa4I8UEDuemesZNDqwog","targetId":"_uJaJwI8UEDuemesZNDqwog","type":"Assignment"},{"id":"_9LdMoI8UEDuemesZNDqwog","sourceId":"_ib2WcI8UEDuemesZNDqwog","targetId":"_vXftgI8UEDuemesZNDqwog","type":"Assignment"},{"id":"_cDi7II8VEDuemesZNDqwog","sourceId":"_uJaJwI8UEDuemesZNDqwog","targetId":"_WuilUI8VEDuemesZNDqwog","type":"Access"},{"id":"_hc6zkI8VEDuemesZNDqwog","sourceId":"_vXftgI8UEDuemesZNDqwog","targetId":"_co1ZgI8VEDuemesZNDqwog","type":"Association"},{"id":"_jV9Y0I8VEDuemesZNDqwog","sourceId":"_vXftgI8UEDuemesZNDqwog","targetId":"_co1ZgI8VEDuemesZNDqwog","type":"Association"},{"id":"_0NAOcI8VEDuemesZNDqwog","sourceId":"_bflZ0I8SEDuemesZNDqwog","targetId":"_xJcW0I8VEDuemesZNDqwog","type":"Association"},{"id":"_1keXsI8VEDuemesZNDqwog","sourceId":"_x9ntII8SEDuemesZNDqwog","targetId":"_xJcW0I8VEDuemesZNDqwog","type":"Association"},{"id":"_MAlYYI8WEDuemesZNDqwog","sourceId":"_08R2oI8SEDuemesZNDqwog","targetId":"_KfRWoI8WEDuemesZNDqwog","type":"Association"},{"id":"_Oh9wAI8WEDuemesZNDqwog","sourceId":"_uJaJwI8UEDuemesZNDqwog","targetId":"_WuilUI8VEDuemesZNDqwog","type":"Association"}],"views":[{"id":"_AZb0k6ziEe2vW5IAILnJcQ","name":"archimate-diagram","viewpoint":""}]}