{"identifier":"https://me.big.tuwien.ac.at/EAModelSet/_JIuKcDklEeufTvxJgLajhw","archimateId":"_JIuKcDklEeufTvxJgLajhw","name":"PAKS-II. Research and development","description":"","formats":["XML","CSV","JSON","ARCHIMATE"],"source":"GenMyModel","repository":"","license":"","sourceFile":"raw-data/genmymodel/_jiukcdkleeuftvxjglajhw.xml","sourceFormat":"XML","timestamp":"2023-07-06T10:01:17","tags":[],"duplicates":[],"language":"ru","elements":[{"id":"_IRbfUBtTEDmpCuKuMOPkqw","name":"УТ1. Разработка требований стейкхолдеров","type":"BusinessFunction","layer":"business"},{"id":"_K4K4EBtTEDmpCuKuMOPkqw","name":"Инженер по управлению требованиями","type":"BusinessRole","layer":"business"},{"id":"_NG2WIBtTEDmpCuKuMOPkqw","name":"Требования стейкхолдеров","type":"Product","layer":"business"},{"id":"_P5AUsBtTEDmpCuKuMOPkqw","name":"ОА1. Определение функциональной архитектуры","type":"BusinessFunction","layer":"business"},{"id":"_Zh_BIBtTEDmpCuKuMOPkqw","name":"Архитектор","type":"BusinessRole","layer":"business"},{"id":"_a8-YcBtTEDmpCuKuMOPkqw","name":"Функциональная диаграмма","type":"Product","layer":"business"},{"id":"_juvJABtTEDmpCuKuMOPkqw","name":"УТ2. Разработка функциональных требований","type":"BusinessFunction","layer":"business"},{"id":"_DisC0BtUEDmpCuKuMOPkqw","name":"Инженер по управлению требованиями","type":"BusinessRole","layer":"business"},{"id":"_FsnjwBtUEDmpCuKuMOPkqw","name":"Функциональные требования","type":"Product","layer":"business"},{"id":"_JYwB0BtVEDmpCuKuMOPkqw","name":"ОА2. Модульный синтез","type":"BusinessFunction","layer":"business"},{"id":"_LfFcMBtVEDmpCuKuMOPkqw","name":"УТ3. Разработка технических требований","type":"BusinessFunction","layer":"business"},{"id":"_Wpk-sBtVEDmpCuKuMOPkqw","name":"Структурная диаграмма","type":"Product","layer":"business"},{"id":"_08wCQBtVEDmpCuKuMOPkqw","name":"Технические требования","type":"Product","layer":"business"}],"relationships":[{"id":"_Mi5UgBtTEDmpCuKuMOPkqw","sourceId":"_K4K4EBtTEDmpCuKuMOPkqw","targetId":"_IRbfUBtTEDmpCuKuMOPkqw","type":"Association"},{"id":"_PPtgEBtTEDmpCuKuMOPkqw","sourceId":"_IRbfUBtTEDmpCuKuMOPkqw","targetId":"_NG2WIBtTEDmpCuKuMOPkqw","type":"Association"},{"id":"_aoSh4BtTEDmpCuKuMOPkqw","sourceId":"_Zh_BIBtTEDmpCuKuMOPkqw","targetId":"_P5AUsBtTEDmpCuKuMOPkqw","type":"Association"},{"id":"_dpNVMBtTEDmpCuKuMOPkqw","sourceId":"_P5AUsBtTEDmpCuKuMOPkqw","targetId":"_a8-YcBtTEDmpCuKuMOPkqw","type":"Association"},{"id":"_eQrvcBtUEDmpCuKuMOPkqw","sourceId":"_juvJABtTEDmpCuKuMOPkqw","targetId":"_DisC0BtUEDmpCuKuMOPkqw","type":"Association"},{"id":"_ewB94BtUEDmpCuKuMOPkqw","sourceId":"_juvJABtTEDmpCuKuMOPkqw","targetId":"_FsnjwBtUEDmpCuKuMOPkqw","type":"Association"},{"id":"_-uO_4BtUEDmpCuKuMOPkqw","sourceId":"_NG2WIBtTEDmpCuKuMOPkqw","targetId":"_P5AUsBtTEDmpCuKuMOPkqw","type":"Flow"},{"id":"_A38eYBtVEDmpCuKuMOPkqw","sourceId":"_NG2WIBtTEDmpCuKuMOPkqw","targetId":"_juvJABtTEDmpCuKuMOPkqw","type":"Flow"},{"id":"_CVjr4BtVEDmpCuKuMOPkqw","sourceId":"_a8-YcBtTEDmpCuKuMOPkqw","targetId":"_juvJABtTEDmpCuKuMOPkqw","type":"Flow"},{"id":"_Pxsg4BtVEDmpCuKuMOPkqw","sourceId":"_a8-YcBtTEDmpCuKuMOPkqw","targetId":"_JYwB0BtVEDmpCuKuMOPkqw","type":"Flow"},{"id":"_Rk1ScBtVEDmpCuKuMOPkqw","sourceId":"_NG2WIBtTEDmpCuKuMOPkqw","targetId":"_LfFcMBtVEDmpCuKuMOPkqw","type":"Flow"},{"id":"_fBazYBtVEDmpCuKuMOPkqw","sourceId":"_Zh_BIBtTEDmpCuKuMOPkqw","targetId":"_JYwB0BtVEDmpCuKuMOPkqw","type":"Association"},{"id":"_f_HKsBtVEDmpCuKuMOPkqw","sourceId":"_JYwB0BtVEDmpCuKuMOPkqw","targetId":"_Wpk-sBtVEDmpCuKuMOPkqw","type":"Association"},{"id":"_grIjMBtVEDmpCuKuMOPkqw","sourceId":"_Wpk-sBtVEDmpCuKuMOPkqw","targetId":"_LfFcMBtVEDmpCuKuMOPkqw","type":"Flow"},{"id":"_4WygMBtVEDmpCuKuMOPkqw","sourceId":"_DisC0BtUEDmpCuKuMOPkqw","targetId":"_LfFcMBtVEDmpCuKuMOPkqw","type":"Association"},{"id":"_6V208BtVEDmpCuKuMOPkqw","sourceId":"_08wCQBtVEDmpCuKuMOPkqw","targetId":"_LfFcMBtVEDmpCuKuMOPkqw","type":"Association"},{"id":"_7nqbEBtVEDmpCuKuMOPkqw","sourceId":"_FsnjwBtUEDmpCuKuMOPkqw","targetId":"_LfFcMBtVEDmpCuKuMOPkqw","type":"Flow"}],"views":[{"id":"_JIuxgjklEeufTvxJgLajhw","name":"archimate-diagram","viewpoint":""}]}