{"identifier":"https://me.big.tuwien.ac.at/EAModelSet/f5eee014-861f-40fe-922e-fe24bfd562c7","archimateId":"f5eee014-861f-40fe-922e-fe24bfd562c7","name":"Esquema","description":"","formats":["XML","CSV","JSON","ARCHIMATE"],"source":"GenMyModel","repository":"","license":"","sourceFile":"raw-data/genmymodel/f5eee014-861f-40fe-922e-fe24bfd562c7.xml","sourceFormat":"XML","timestamp":"2023-07-06T10:01:18","tags":[],"duplicates":[],"language":"es","elements":[{"id":"_HAxLALUPEDaaVc4rj22kRw","name":"PLAN DE TRABAJO","type":"BusinessService","layer":"business"},{"id":"_Nia6IbUPEDaaVc4rj22kRw","name":"PLAN DE TRABAJO","type":"TechnologyService","layer":"technology"},{"id":"_P3f7IbUPEDaaVc4rj22kRw","name":"MARKETING","type":"TechnologyService","layer":"technology"},{"id":"_dnm1AbUPEDaaVc4rj22kRw","name":"Desarrolla una investigación de mercado","type":"ApplicationService","layer":"application"},{"id":"_eTOk4bUPEDaaVc4rj22kRw","name":"Elabora ánalisis de la competencia","type":"ApplicationService","layer":"application"},{"id":"_fbvFEbUPEDaaVc4rj22kRw","name":"Estudios de mercado","type":"ApplicationService","layer":"application"},{"id":"_Ot8j0NI0EDa6P43StyjgDw","name":"PRODUCCION","type":"TechnologyService","layer":"technology"},{"id":"_QNE0QNI0EDa6P43StyjgDw","name":"ORGANIZACION","type":"TechnologyService","layer":"technology"},{"id":"_RMoz0NI0EDa6P43StyjgDw","name":"ASPECTOS LEGALES DE IMPLANTACION Y OPERACION","type":"TechnologyService","layer":"technology"},{"id":"_Uxy8oNI0EDa6P43StyjgDw","name":"FINANZAS","type":"TechnologyService","layer":"technology"},{"id":"_XiYN4NI0EDa6P43StyjgDw","name":"INTEGRACION DE ACTIVIDADES","type":"TechnologyService","layer":"technology"},{"id":"_guKoANI0EDa6P43StyjgDw","name":"Establece el sistema de distribucción","type":"ApplicationService","layer":"application"},{"id":"_m45E4NI0EDa6P43StyjgDw","name":"Diseño de empaque","type":"ApplicationService","layer":"application"},{"id":"_cw5EsNI1EDa6P43StyjgDw","name":"Publicidad de la empresa","type":"ApplicationService","layer":"application"},{"id":"_foKz0NI1EDa6P43StyjgDw","name":"Diseño, etiquetas, anuncios, nombre comercial","type":"ApplicationService","layer":"application"},{"id":"_f3lI0NI1EDa6P43StyjgDw","name":"Define sistema de promoción","type":"ApplicationService","layer":"application"},{"id":"_fSfh8NI5EDa6P43StyjgDw","name":"Metas","type":"WorkPackage","layer":"implementation_migration"},{"id":"_YxmLUNI6EDaLK_908QdQtw","name":"Asignar tiempos","type":"WorkPackage","layer":"implementation_migration"},{"id":"_ZGVsQNI6EDaLK_908QdQtw","name":"Responsabilidades","type":"WorkPackage","layer":"implementation_migration"},{"id":"_ZntT8NI6EDaLK_908QdQtw","name":"Recursos","type":"WorkPackage","layer":"implementation_migration"}],"relationships":[{"id":"_W07AQLUPEDaaVc4rj22kRw","sourceId":"_HAxLALUPEDaaVc4rj22kRw","targetId":"_Nia6IbUPEDaaVc4rj22kRw","type":"Triggering"},{"id":"_XZfs8rUPEDaaVc4rj22kRw","sourceId":"_HAxLALUPEDaaVc4rj22kRw","targetId":"_P3f7IbUPEDaaVc4rj22kRw","type":"Triggering"},{"id":"_qNCWMNI0EDa6P43StyjgDw","sourceId":"_HAxLALUPEDaaVc4rj22kRw","targetId":"_Ot8j0NI0EDa6P43StyjgDw","type":"Triggering"},{"id":"_t0lrsNI0EDa6P43StyjgDw","sourceId":"_HAxLALUPEDaaVc4rj22kRw","targetId":"_QNE0QNI0EDa6P43StyjgDw","type":"Triggering"},{"id":"_xhrBcNI0EDa6P43StyjgDw","sourceId":"_HAxLALUPEDaaVc4rj22kRw","targetId":"_RMoz0NI0EDa6P43StyjgDw","type":"Triggering"},{"id":"_0uZcINI0EDa6P43StyjgDw","sourceId":"_HAxLALUPEDaaVc4rj22kRw","targetId":"_XiYN4NI0EDa6P43StyjgDw","type":"Triggering"},{"id":"_12LjkNI0EDa6P43StyjgDw","sourceId":"_HAxLALUPEDaaVc4rj22kRw","targetId":"_Uxy8oNI0EDa6P43StyjgDw","type":"Triggering"},{"id":"_tO_ZYNI2EDa6P43StyjgDw","sourceId":"_dnm1AbUPEDaaVc4rj22kRw","targetId":"_eTOk4bUPEDaaVc4rj22kRw","type":"Composition"},{"id":"_vW0BgNI2EDa6P43StyjgDw","sourceId":"_dnm1AbUPEDaaVc4rj22kRw","targetId":"_eTOk4bUPEDaaVc4rj22kRw","type":"Association"},{"id":"_zGYDgdI2EDa6P43StyjgDw","sourceId":"_eTOk4bUPEDaaVc4rj22kRw","targetId":"_fbvFEbUPEDaaVc4rj22kRw","type":"Association"},{"id":"_0IK3sNI2EDa6P43StyjgDw","sourceId":"_fbvFEbUPEDaaVc4rj22kRw","targetId":"_guKoANI0EDa6P43StyjgDw","type":"Association"},{"id":"_078eAdI2EDa6P43StyjgDw","sourceId":"_guKoANI0EDa6P43StyjgDw","targetId":"_cw5EsNI1EDa6P43StyjgDw","type":"Association"},{"id":"_2o9ZcNI2EDa6P43StyjgDw","sourceId":"_cw5EsNI1EDa6P43StyjgDw","targetId":"_foKz0NI1EDa6P43StyjgDw","type":"Association"},{"id":"_3wozMdI2EDa6P43StyjgDw","sourceId":"_foKz0NI1EDa6P43StyjgDw","targetId":"_f3lI0NI1EDa6P43StyjgDw","type":"Association"},{"id":"_4vWeMNI2EDa6P43StyjgDw","sourceId":"_f3lI0NI1EDa6P43StyjgDw","targetId":"_m45E4NI0EDa6P43StyjgDw","type":"Association"},{"id":"_X0S1kNI6EDaLK_908QdQtw","sourceId":"_P3f7IbUPEDaaVc4rj22kRw","targetId":"_dnm1AbUPEDaaVc4rj22kRw","type":"Association"},{"id":"_Y9EJkNI8EDaLK_908QdQtw","sourceId":"_Nia6IbUPEDaaVc4rj22kRw","targetId":"_YxmLUNI6EDaLK_908QdQtw","type":"Association"},{"id":"_cMLw8dI8EDaLK_908QdQtw","sourceId":"_YxmLUNI6EDaLK_908QdQtw","targetId":"_ZGVsQNI6EDaLK_908QdQtw","type":"Association"},{"id":"_gg6VgNI8EDaLK_908QdQtw","sourceId":"_ZGVsQNI6EDaLK_908QdQtw","targetId":"_fSfh8NI5EDa6P43StyjgDw","type":"Association"},{"id":"_iCL7ANI8EDaLK_908QdQtw","sourceId":"_fSfh8NI5EDa6P43StyjgDw","targetId":"_ZntT8NI6EDaLK_908QdQtw","type":"Association"}],"views":[{"id":"_LxrBctLgEeiczqJWtOPN4Q","name":"Esquema","viewpoint":""},{"id":"_FxI1UNI-EDaLK_908QdQtw","name":"archimate-diagram","viewpoint":""},{"id":"_GKqIkNI-EDaLK_908QdQtw","name":"archimate-diagram2","viewpoint":""},{"id":"_Gp-h0dI-EDaLK_908QdQtw","name":"archimate-diagram3","viewpoint":""},{"id":"_HR1MANI-EDaLK_908QdQtw","name":"archimate-diagram4","viewpoint":""}]}